{
  "$schema": "./schemas/skills-registry.schema.json",
  "registryVersion": 1,
  "catalogVersion": "0.1.0",
  "repo": "maiconsouza89/mass-agents-skills",
  "rawBase": "https://raw.githubusercontent.com/maiconsouza89/mass-agents-skills",
  "categories": {
    "meta": {
      "name": "Meta",
      "description": "Skills that create, review and maintain other skills in this catalog.",
      "order": 1
    },
    "quality": {
      "name": "Quality",
      "description": "Code review, testing strategy and everything that keeps the codebase healthy.",
      "order": 2
    },
    "language": {
      "name": "Language",
      "description": "TypeScript conventions and language-level rules shared by every Mass Solutions project.",
      "order": 3
    },
    "frontend": {
      "name": "Frontend",
      "description": "React, Next.js, accessibility and UI patterns.",
      "order": 4
    },
    "backend": {
      "name": "Backend",
      "description": "NestJS, API design and server-side conventions.",
      "order": 5
    },
    "workflow": {
      "name": "Workflow",
      "description": "Git, commits, pull requests and delivery process.",
      "order": 6
    },
    "security": {
      "name": "Security",
      "description": "Secure coding checklists and threat-aware reviews.",
      "order": 7
    },
    "performance": {
      "name": "Performance",
      "description": "Web performance, Core Web Vitals and bundle hygiene.",
      "order": 8
    }
  },
  "skills": [
    {
      "name": "mass-api-design",
      "description": "Designs HTTP APIs to the Mass Solutions REST conventions, covering resource naming, status codes, the standard error envelope, pagination, filtering, versioning, idempotency and OpenAPI documentation. Use when the user says \"design the API\", \"REST endpoint\", \"what should the response look like\", \"pagination\", \"error format\", \"standardize our error responses\", \"API versioning\" or is defining a new HTTP contract. Do NOT use for NestJS file layout or dependency injection (use mass-nestjs-modules), Next.js route handlers as UI glue (use mass-nextjs-app-router) or GraphQL schemas.",
      "category": "backend",
      "tags": [
        "api",
        "rest",
        "http",
        "openapi",
        "pagination"
      ],
      "owner": "@maiconsouza89",
      "version": "1.0.0",
      "reviewed": "2026-09-14",
      "path": "skills/mass-api-design",
      "files": [
        {
          "path": "SKILL.md",
          "sha256": "9f57a45cfd44e115c148e96df5886a9c49743924fe18fe5b13d4cf449faeed0d",
          "bytes": 4940,
          "executable": false
        },
        {
          "path": "references/error-format.md",
          "sha256": "da84ad0a006f5424274bf683483f9afc7eaa14a2b632aeb084ed942e1c1b7518",
          "bytes": 2758,
          "executable": false
        },
        {
          "path": "references/pagination.md",
          "sha256": "6e1741f210a85f9a6b73f42c61507d56548e98236827b5ec24e63e9954cc9535",
          "bytes": 2333,
          "executable": false
        }
      ],
      "contentHash": "839eaea01ab631cd14cf28288b527984409298f0cb33662151d38a2c7faa0f1a",
      "tokens": {
        "skillMd": 1235,
        "total": 2509
      },
      "license": "MIT"
    },
    {
      "name": "mass-code-review",
      "description": "Reviews a pull request or branch of TypeScript, React, Next.js or NestJS code and delivers one consolidated, evidence-backed review with severity-ranked findings. Use when the user says \"review this PR\", \"code review\", \"check my branch before merge\", \"review my changes\" or pastes a pull request URL. Do NOT use for writing tests (use mass-testing-strategy), fixing CI failures, or general refactoring without a review request.",
      "category": "quality",
      "tags": [
        "review",
        "pull-request",
        "quality",
        "github"
      ],
      "owner": "@maiconsouza89",
      "version": "1.0.0",
      "reviewed": "2026-09-14",
      "path": "skills/mass-code-review",
      "files": [
        {
          "path": "SKILL.md",
          "sha256": "6198e79e826dc273d8cc3e6c47c0f0be72fc3ee0e152be11fec222bce48befc3",
          "bytes": 5688,
          "executable": false
        },
        {
          "path": "references/review-checklist.md",
          "sha256": "8b2dfff6e9f13b7ac5bb81b34e98031c765fdf1ee96ef20ebf8fe96404f4188c",
          "bytes": 3392,
          "executable": false
        },
        {
          "path": "references/severity-rubric.md",
          "sha256": "aeb64608115c5dda682db710d54580cfb808bc75e8b6046563f8854e88cf8231",
          "bytes": 1787,
          "executable": false
        },
        {
          "path": "scripts/pr-context.sh",
          "sha256": "fd125e415b314cbff53de18fc6785955820204321958c08bd838b6d5e57e55a6",
          "bytes": 1667,
          "executable": true
        }
      ],
      "contentHash": "749e112ea16a1e9aaba863b62a82a1da87911394c2fc0fe299987fcb6e1e43f6",
      "tokens": {
        "skillMd": 1422,
        "total": 2717
      },
      "license": "MIT",
      "compatibility": "Works best with git and the GitHub CLI (gh) available; falls back to a local diff review without gh.",
      "requires": {
        "skills": [
          "mass-typescript-conventions"
        ],
        "tools": [
          "git",
          "gh"
        ]
      }
    },
    {
      "name": "mass-commit-and-pr",
      "description": "Produces commits, branches and pull requests that follow the Mass Solutions delivery conventions, with Conventional Commits messages, branch naming, small reviewable PRs, a filled PR template and changelog entries. Use when the user says \"commit this\", \"write a commit message\", \"open a PR\", \"create a pull request\", \"name the branch\" or \"get this ready to merge\". Do NOT use for reviewing someone else's PR (use mass-code-review), fixing CI failures or release versioning of npm packages.",
      "category": "workflow",
      "tags": [
        "git",
        "commits",
        "pull-requests",
        "conventional-commits"
      ],
      "owner": "@maiconsouza89",
      "version": "1.0.0",
      "reviewed": "2026-09-14",
      "path": "skills/mass-commit-and-pr",
      "files": [
        {
          "path": "SKILL.md",
          "sha256": "f8567b1089dc60754c5aa434b659a9af345078ee10623de2d7cb5e7f6b658de4",
          "bytes": 4575,
          "executable": false
        },
        {
          "path": "assets/pr-template.md",
          "sha256": "106276e65ba1dc98dfd4164358625eefe3593844701a55b6ee9ce93095a32089",
          "bytes": 888,
          "executable": false
        },
        {
          "path": "scripts/check-commit-msg.sh",
          "sha256": "a1ad4936ab15e9039c702448f9722c45f2d1e79a8023b63c6389cc746cf91ddc",
          "bytes": 1383,
          "executable": true
        }
      ],
      "contentHash": "361b1a3951e6644d8612890cd600374b6277d6fc72d3aa555d09ee5e4e762b25",
      "tokens": {
        "skillMd": 1144,
        "total": 1366
      },
      "license": "MIT",
      "compatibility": "Uses git and, when available, the GitHub CLI (gh).",
      "requires": {
        "tools": [
          "git",
          "gh"
        ]
      }
    },
    {
      "name": "mass-nestjs-modules",
      "description": "Creates and refactors NestJS modules following the Mass Solutions layout, with thin controllers, validated DTOs, application services, repositories behind interfaces, exception filters and dependency injection rules. Use when the user says \"create a NestJS module\", \"add an endpoint in Nest\", \"new controller\", \"new service\", \"where does this logic go in Nest\" or is working in a NestJS codebase. Do NOT use for REST contract decisions such as pagination or error envelope shape (use mass-api-design), TypeScript typing rules (use mass-typescript-conventions) or writing tests (use mass-testing-strategy).",
      "category": "backend",
      "tags": [
        "nestjs",
        "backend",
        "modules",
        "dependency-injection"
      ],
      "owner": "@maiconsouza89",
      "version": "1.0.0",
      "reviewed": "2026-09-14",
      "path": "skills/mass-nestjs-modules",
      "files": [
        {
          "path": "SKILL.md",
          "sha256": "6a8b1020dd63e7710fd04ffb8ae2ff4f8458d1c8ef7adb885f34fb6fabae7da2",
          "bytes": 5257,
          "executable": false
        },
        {
          "path": "assets/module.template.ts",
          "sha256": "3e9d9d57aeab39e93360b03fd8bb1b1b7241f37870a77e683cbb6107cc99ee94",
          "bytes": 2757,
          "executable": false
        },
        {
          "path": "references/dto-validation.md",
          "sha256": "5b5661346e1689596915b5124a026e91fc6cf42007a4b2f0e09eaaad0e4b3003",
          "bytes": 2136,
          "executable": false
        },
        {
          "path": "references/module-layout.md",
          "sha256": "0cd341469e29598f9e3285c2347c7f7986fb1e7dc9786c006a26561e1d3b8cd7",
          "bytes": 2535,
          "executable": false
        }
      ],
      "contentHash": "af3be8e10f74619d7b6c3928f3613dbfcba0b70ee05193e844d46df470af2199",
      "tokens": {
        "skillMd": 1315,
        "total": 2483
      },
      "license": "MIT",
      "compatibility": "Targets NestJS 10 or newer with class-validator or zod for DTO validation.",
      "requires": {
        "skills": [
          "mass-typescript-conventions",
          "mass-api-design"
        ]
      }
    },
    {
      "name": "mass-nextjs-app-router",